{"dataPractices":{"acceptedClassifications":["PUBLIC_SYNTHETIC"],"networkUse":false,"trainingUse":false},"evaluatorId":"evaldossier-reference-evaluator","evaluatorType":"NATIVE","expiresAt":"2027-07-21T12:00:00Z","issuedAt":"2026-07-21T12:00:00Z","keys":[{"alg":"EdDSA","crv":"Ed25519","kid":"k6izTCg-VUwn3hb6Gd5PjK7bGzrZIYj2wrSXbfwz-i4","kty":"OKP","use":"sig","x":"R558iM3wPW34I3VnVUXLszWAyUmDzoTcqLMM-Wez7LU"}],"manifestId":"reference-evaluator-manifest-v0","operator":{"displayName":"EvalDossier reference evaluator","id":"evaldossier-reference-operator","relationship":"INTERNAL_REFERENCE_OPERATOR"},"profiles":[{"digest":{"algorithm":"sha-256","value":"57e50c3fbd00ae371d6bf60b192bf0d739c092bcdb4011330a0198a9a79b792a"},"id":"json-artifact-conformance-v0","version":"0.1.0"}],"proof":{"jws":"eyJhbGciOiJFZERTQSIsImtpZCI6Ims2aXpUQ2ctVlV3bjNoYjZHZDVQaks3Ykd6clpJWWoyd3JTWGJmd3otaTQiLCJ0eXAiOiJldmFsZG9zc2llci5ldmFsdWF0b3ItbWFuaWZlc3QvMC4xIn0..8LbQPcpwFkTe0Jv4fcGJjJq8ZKoTXKzDdhAILs8KHKAkGMtbgu1Y_8h4kJ06IyL-L9V5ZHM51ryTWQvQUeODBg","type":"evaldossier.detached-jws/0.1"},"protocolVersion":"evaldossier/0.1","schemaVersion":"evaldossier.evaluator-manifest/0.1","signatureContext":{"audience":"evaldossier-offline-demo","nonce":"reference-manifest-nonce-0001"},"signingKeyId":"k6izTCg-VUwn3hb6Gd5PjK7bGzrZIYj2wrSXbfwz-i4","software":{"name":"evaldossier-reference-evaluator","sourceVisibility":"OPEN_SOURCE","version":"0.1.0"}}