{"dataPractices":{"acceptedClassifications":["PUBLIC_SYNTHETIC"],"networkUse":false,"trainingUse":false},"evaluatorId":"evaldossier-model-judgment-fixture-adapter","evaluatorType":"ADAPTER","expiresAt":"2027-07-21T12:05:00Z","issuedAt":"2026-07-21T12:05:00Z","keys":[{"alg":"EdDSA","crv":"Ed25519","kid":"DMxP7NUQjNSMD6VwECGLzuKW5AUt6esyUelZOYN8-Zw","kty":"OKP","use":"sig","x":"zu0OShi6bccH4hfzGD1IP88htWPCpTm-ZntpLpMYSlc"}],"manifestId":"model-judgment-adapter-manifest-v0","operator":{"displayName":"EvalDossier synthetic fixture adapter","id":"evaldossier-adapter-operator","relationship":"INTERNAL_REFERENCE_OPERATOR"},"profiles":[{"digest":{"algorithm":"sha-256","value":"44ac90c7f4de6e5e26d8641bfb7ac68fc2cf70115987edfe6ed1fe834ec6ec2c"},"id":"synthetic-model-judgment-normalization-v0","version":"0.1.0"}],"proof":{"jws":"eyJhbGciOiJFZERTQSIsImtpZCI6IkRNeFA3TlVRak5TTUQ2VndFQ0dMenVLVzVBVXQ2ZXN5VWVsWk9ZTjgtWnciLCJ0eXAiOiJldmFsZG9zc2llci5ldmFsdWF0b3ItbWFuaWZlc3QvMC4xIn0..fRVSInSVtm0sB6I8pkYd0_eZgT08Td_Mt42HT0kxWrhL41-L1LNyy7M0UkeaSHpsdqTXaSMFrDZRsazOc7czAQ","type":"evaldossier.detached-jws/0.1"},"protocolVersion":"evaldossier/0.1","schemaVersion":"evaldossier.evaluator-manifest/0.1","signatureContext":{"audience":"evaldossier-offline-demo","nonce":"model-judgment-manifest-nonce-0001"},"signingKeyId":"DMxP7NUQjNSMD6VwECGLzuKW5AUt6esyUelZOYN8-Zw","software":{"name":"evaldossier-model-judgment-fixture-adapter","sourceVisibility":"OPEN_SOURCE","version":"0.1.0"}}