{"dataPractices":{"acceptedClassifications":["PUBLIC_SYNTHETIC"],"networkUse":false,"trainingUse":false},"evaluatorId":"evaldossier-reference-evaluator","evaluatorType":"NATIVE","expiresAt":"2027-07-21T12:00:00Z","issuedAt":"2026-07-21T12:00:00Z","keys":[{"alg":"EdDSA","crv":"Ed25519","kid":"y9WZZlkOvtQjWU4AR4b9iWnHg7cenc9rVVrN9LI4vNk","kty":"OKP","use":"sig","x":"JohqSVGxEz5bpComkhEdH97gGwFmt3__X2LIRhSoHZE"}],"manifestId":"reference-evaluator-manifest-v0","operator":{"displayName":"EvalDossier reference evaluator","id":"evaldossier-reference-operator","relationship":"INTERNAL_REFERENCE_OPERATOR"},"profiles":[{"digest":{"algorithm":"sha-256","value":"61fea8d71334ebe2e41d21a273a04a8bec76931fbe9a95fa017036d0f32dfc49"},"id":"json-artifact-conformance-v0","version":"0.1.0"}],"proof":{"jws":"eyJhbGciOiJFZERTQSIsImtpZCI6Ink5V1pabGtPdnRRaldVNEFSNGI5aVduSGc3Y2VuYzlyVlZyTjlMSTR2TmsiLCJ0eXAiOiJldmFsZG9zc2llci5ldmFsdWF0b3ItbWFuaWZlc3QvMC4xIn0..LplAQonBGHvX4CCdSP9G0QzlGcjItSQ4fwBqJ1vXAJeXPACbgKUwZvBIpZ3mUenGi3rLJfN1mkHdX0futqoeAg","type":"evaldossier.detached-jws/0.1"},"protocolVersion":"evaldossier/0.1","schemaVersion":"evaldossier.evaluator-manifest/0.1","signatureContext":{"audience":"evaldossier-offline-demo","nonce":"reference-manifest-nonce-0001"},"signingKeyId":"y9WZZlkOvtQjWU4AR4b9iWnHg7cenc9rVVrN9LI4vNk","software":{"name":"evaldossier-reference-evaluator","sourceVisibility":"OPEN_SOURCE","version":"0.1.0"}}